{
  "assertions": [
    {
      "observation": {
        "equals": {
          "expanded": false,
          "preset_label": "Morning / Calm",
          "volume": 72,
          "dirty": false,
          "applied_quality": "Balanced",
          "apply_count": 0,
          "reset_count": 0,
          "applied_volume": 72,
          "preset": "morning-calm",
          "applied_preset": "morning-calm",
          "quality": "Balanced"
        },
        "key": "settings"
      }
    },
    {
      "observation": {
        "equals": 120,
        "key": "preset_count"
      }
    },
    {
      "observation": {
        "equals": {
          "reader_b_releases": 0,
          "reader_b_presses": 0,
          "presses": 0,
          "last_release_b": false,
          "held": false,
          "mismatches": 0,
          "last_release_a": false,
          "hold_ticks": 0,
          "reader_a_presses": 0,
          "total_held_ticks": 0,
          "reader_a_releases": 0,
          "releases": 0,
          "last_press_a": false,
          "last_press_b": false
        },
        "key": "input_probe"
      }
    }
  ],
  "input": {},
  "frames": 1,
  "name": "settings-defaults",
  "seed": 42,
  "input_sequence": []
}
